record_id,label_true,affiliation
6888,2611,"Siemens Technology-to-Business Center, 1995 University Ave, Suite 375, Berkeley, California"
1156,6468,Simon Fraser U.
2440,6468,Simon Fraser University
919,6468,"Simon Fraser University, Burnaby, BC, Canada"
9374,6468,"Simon Fraser University, Burnaby, Canada"
72,6468,"Simon Fraser University, Canada"
1807,6468,"Simon Fraser University, School of Computing Science, Burnaby BC, Canada"
6402,6468,"Simon Fraser University, Vancouver, Canada"
3219,514,Singapore Management University
2275,514,"Singapore Management University, Singapore"
5556,514,"Singapore Management University, Singapore, Singapore"
9626,8338,SLAC
7324,8694,"SoC, National University of Singapore"
1601,1601,"Software AG, Darmstadt, Germany"
7703,1601,Software AG; e-mail: Thorsten.Fiebig@softwareag.com
741,5840,"Software Laboratories, Samsung Electronics Co., Ltd., Suwon-City, Gyeonggi-Do, Korea"
7440,7888,"Southwest Texas State University, San Marcos, Texas"
1561,347,"Spatial Technologies, Oracle Corporation, Nashua, New Hampshire"
542,8338,Stanford
7579,8338,"Stanford Univ., Stanford, CA"
113,8338,Stanford University
844,8338,Stanford University InfoLab
1859,8338,"Stanford University, Computer Science Department, Stanford, CA"
1508,8338,"Stanford University, Palo Alto"
1591,8338,"Stanford University, Palo Alto, CA"
8645,8338,"Stanford University, Palo Alto, USA"
1872,8338,"Stanford University, Stanford"
144,8338,"Stanford University, Stanford, CA"
7673,8338,"Stanford University, Stanford, CA 94305, USA; e-mail: rada&commat;cs.stanford.edu"
5772,8338,"Stanford University, Stanford, CA, USA"
1182,8338,"Stanford University, Stanford, California"
6233,8338,"Stanford University, Stanford, California, USA"
6423,8338,"Stanford University, Stanford, USA"
8082,8338,"Stanford University, USA"
2054,2054,"Stata Labs, Inc."
2053,2054,"Stata Labs, Inc., UC Santa Cruz"
1686,8823,State University of New York at Buffalo
2382,773,State University of New York at Stony Brook
2061,8823,"State University of New York, at Buffalo"
8383,8381,"Statistics Group, Rovira i Virgili University of Tarragona, Catalonia"
6873,6873,Steven Institute of Technology
1082,6873,Stevens Institute of Technology
7711,6873,"Stevens Institute of Technology, Castle Point on Hudson, Hoboken, NJ 07030, USA; e-mail: scho@puma.mt.att.com"
1129,773,Stony Brook University
183,773,"Stony Brook University, Stony Brook, NY"
9180,8691,Sun Yat-Sen University
3089,705,SUNY at Binghamton
458,705,"SUNY at Binghamton, Binghamton, NY"
4822,8823,SUNY Buffalo
5488,8823,"SUNY Buffalo, Buffalo, NY"
6161,8823,"SUNY Buffalo, Buffalo, NY, USA"
3662,3662,Surromed Inc
3451,3662,"Surromed, Palo Alto, CA, USA"
7865,1640,"Swiss Federal Institute of Technology (ETH) Zurich, Institute of Information Systems, ETH Zentrum, 8092 Zurich, Switzerland; E-mail: tuerker@inf.ethz.ch"
7632,1640,"Swiss Federal Institute of Technology (ETH), Zürich, Switzerland"
7908,1640,"Swiss Federal Institute of Technology (ETHZ), Zürich, Switzerland"
7585,1640,"Swiss Federal Institute of Technology,  Zürich, Switzerland"
1146,1640,"Swiss Federal Institute of Technology, ETH Zentrum, Zurich, Switzerland"
1148,1640,"Swiss Federal Institute of Technology, ETH Zentrum, Zurich, SwitzerlandSwiss Federal Institute of Technology, ETH Zentrum, Zurich, Switzerland"
3891,3891,Sybase France
6302,3891,"Sybase, Inc., Paris, France"
4372,4372,"Syracuse University, Syracuse, NY"
5664,4372,"Syracuse University, Syracuse, NY, USA"
1336,6718,T. J. Watson Resch. Ctr.
50,6718,"T. J. Watson Research Center, IBM"
3846,3846,Tavant
7630,3846,Tavant Technologies
1092,7930,"TCS Lab for Internet Research, Department of Computer Science and Engineering, Indian Institute of Technology Bombay, Mumbai, India"
1330,7930,"TCS Lab for Internet Research, Dept of Comp Science and Engg, Indian Institute of Technology Bombay, Mumbai, India"
3143,3143,Technical University of Crete
9349,3143,"Technical University of Crete, Chania, Greece"
4301,3143,"Technical University of Crete, Crete, Greece"
6231,536,"Technical University of Dortmund, Dortmund, Germany"
5599,1143,"Technical University of Munich, Munich, Germany"
3751,979,Technical University of Wien
4835,6866,Technion
425,6866,"Technion - IIT, Haifa, Israel"
8131,6866,"Technion - Israel Institute of Technology, Israel"
8323,6866,"Technion---Israel Institute of Technology, Haifa, Israel"
2685,6866,"Technion---Israel Institute of Technology, Technion City, Haifa, Israel"
718,6866,"Technion, Haifa, Israel"
679,5136,"Technische Universität Dresden, Dresden, Germany"
8649,5136,"Technische Universität Dresden, Dresden, Germany 01062"
6280,1143,"Technische Universität München, Garching, Germany"
467,1143,"Technische Universität München, Germany"
7823,1143,"Technische Universität München, Institut für Informatik, 81667 München, Germany; E-mail: kossmann@in.tum.de"
397,1143,"Technische Universität München, Munich, Germany"
1762,979,"Technische Universität Wien, Vienna, Austria"
7617,979,"Technische Universität Wien, Wien, Austria"
394,7815,Tel Aviv University
2688,7815,"Tel Aviv University, Israel"
3119,7815,"Tel Aviv University, Tel Aviv, Israel"
7397,7815,Tel-Aviv University
8830,7815,"Tel-Aviv University, Tel-Aviv, Israel"
3632,3632,Telcordia Technologies
6628,3632,"Telcordia Technologies, Morristown, NJ"
3526,3632,"Telcordia, Morristown, NJ, USA"
3071,8141,Telecom ParisTech
3265,1472,Teradata
6296,6296,"Teradata Corporation, Elsegundo, CA, USA"
8889,1472,"Teradata Division, NCR Corporation, Los Angeles, USA 90245"
9562,1472,"Teradata, El Segundo, CA"
6299,6296,"Teradata, Elsegundo, CA, USA"
4231,1472,"Teradata, NCR, San Diego, CA"
9561,1472,"Teradata, San Diego, CA"
5823,1472,"Teradata, San Diego, CA, USA"
5068,7888,Texas State University
6123,7888,"Texas State University-San Marcos, San Marcos, TX, USA"
1239,4246,"The Boeing Company, Seattle, WA"
70,3308,The Chinese University of Hong Kong
2461,3308,"The Chinese University of Hong Kong, China"
2363,3308,"The Chinese University of Hong Kong, Hong Kong"
48,3308,"The Chinese University of Hong Kong, Hong Kong, China"
9231,3308,"The Chinese University of Hong Kong, New Territories, Hong Kong"
195,3308,"The Chinese University of Hong Kong, Shatin, Hong Kong"
9376,3308,"The Chinese University of Hong Kong, Shatin, Hong Kong, China"
8435,8435,"The College of William and Mary, USA"
64,8435,"The College of William and Mary, Williamsburg, VA"
599,393,The Hebrew University
2203,9458,"The Hebrew University of Jerusalem, Edmond J. Safra Campus Jerusalem, Israel"
5729,393,"The Hebrew University of Jerusalem, Jerusalem, Israel"
721,393,"The Hebrew University, Jerusalem, Israel"
2228,268,The Hong Kong Polytechnic University
5709,268,"The Hong Kong Polytechnic University, Hong Kong, Hong Kong"
6,268,"The Hong Kong Polytechnic University, Hung Hom, Kowloon, Hong Kong"
9175,1810,The Hong Kong University of Science and Technology
9232,1810,"The Hong Kong University of Science and Technology, Clear Water Bay, Hong Kong"
7623,1810,"The Hong Kong University of Science and Technology, Clearwater Bay, Hong Kong"
9276,1810,"The Hong Kong University of Science and Technology, Hong Kong"
51,1810,"The Hong Kong University of Science and Technology, Hong Kong, China"
5566,1810,"The Hong Kong University of Science and Technology, Hong Kong, Hong Kong"
8774,1810,"The Hong Kong University of Science and Technology, Kowloon, Hong Kong"
7153,6590,The Johns Hopkins University
299,4591,The MITRE Corporation
8314,8314,"The MITRE Corporation, McLean, VA"
6174,4591,"The MITRE Corporation, McLean, VA, USA"
1452,8314,"The MITRE Corporation, McLean, Virginia"
1450,1451,"The MITRE Corporation, McLean, Virginia and Computer Science Department, Center for Automation Research and Institute for Advanced Computer Studies, University of Maryland at College Park"
1936,1451,"The MITRE Corporation, McLean, Virginia and Computer Science Department, Center for Automation Research, and Institute for Advanced Computer Studies, University of Maryland at College Park"
8421,4591,"The MITRE Corporation, USA"
746,2990,The Ohio State University
173,2990,"The Ohio State University, Columbus, OH"
5661,2990,"The Ohio State University, Columbus, OH, USA"
6178,2990,"The Ohio State University, Columbus, USA"
8350,861,"The Penn State University, USA"
6070,861,"The Pennsylvania State University, University Park, PA, USA"
9387,9458,"The Selim and Rachel Benin School of Engineering and Computer Science, The Hebrew University of Jerusalem, Jerusalem, Israel 91094"
1932,9458,"The Selim and Rachel Benin School of Engineering and Computer Science, The Hebrew University, Jerusalem"
3446,3446,"The TimesTen Team, Mountain View, CA, USA"
7628,1734,The University of British Columbia
7967,1734,"The University of British Columbia, Vancouver, BC, Canada"
2226,8992,The University of Hong Kong
7,8992,"The University of Hong Kong, Hong Kong"
5710,8992,"The University of Hong Kong, Hong Kong, Hong Kong"
8313,1451,"The University of Maryland at College Park, College Park, MD"
8312,1451,"The University of Maryland at College Park/The MITRE Corporation, McLean, VA"
5715,9351,"The University of Melbourne, Melbourne, Australia"
8788,9351,"The University of Melbourne, Victoria, Australia"
8309,1480,"The University of Michigan---Dearborn, Dearborn, MI"
66,2131,The University of New South Wales
3310,2131,"The University of New South Wales, Australia"
2840,2131,"The University of New South Wales, Sydney, Australia"
7439,2131,"The University of New South Wales, Sydney, NSW, Australia"
2676,8508,The University of Queensland
8465,8508,"The University of Queensland, Australia"
4573,8508,"The University of Queensland, Brisbane, Australia"
9191,8508,"The University of Queensland, National ICT Australia (NICTA), Brisbane"
7591,7591,The University of Texas at Arlington
4041,7591,"The University of Texas at Arlington, Arlington, TX"
6649,7591,"The University of Texas at Arlington, CSE, 416 Yates Street, P.O.Box 19015, Arlington, TX"
4279,7989,"The University of Texas at Dallas, Richardson, TX"
3291,9332,The University of Tokyo
9258,2038,"Thomas J. Watson Center, IBM Research, Hawthorne, USA 10532"
2302,2038,"Thomas J. Watson Research Center, IBM Research, Hawthorne, NY"
7165,3446,"TimesTen Performance Software, Mountain View, CA"
1138,1138,"TransAction Software GmbH Gustav-Heinemann-Ring, München, Germany"
3536,1138,TransAction Software GmbH Munich
2603,2603,"Tsinghua University, Beijing, China"
2895,2603,"Tsinghua University, Beijing, P.R. China"
8534,2603,"Tsinghua University, Beijing, PR China"
5034,5136,TU Dresden
4067,8448,"TU Eindhoven, Eindhoven, The Netherlands"
2939,8144,"TU Ilmenau, Germany"
7229,1143,TU München
2529,1143,"TU München, Garching, Germany"
9017,1143,"TU München, Munich, Germany"
7230,1143,"TU München, XQRL, Inc."
3469,1143,TUM
1875,6752,U of Pennsylvania
9603,543,U. C. Berkeley
4550,543,"U. C. Berkeley, Berkeley, CA"
3067,855,U. C. Santa Cruz
4045,6684,"U. di Roma """"La Sapienza"""""
1155,1734,U. of British Columbia
1157,7856,U. of Illinois
4043,532,U. of Michigan
4866,7591,U. of Texas at Arlington
5132,8871,"U. of Torino, Torino, Italy"
4198,543,U.C. Berkeley
752,543,U.C. Berkeley Department of Electrical Engineering and Computer Science
663,543,"U.C. Berkeley, EECS Dept., Berkeley, CA"
4199,543,"U.C. Berkeley, Intel Research, Berkeley"
9450,7987,"U.C. San Diego, La Jolla, CA"
6609,2095,"U.Paris XI, LRI, 91405 Orsay, France"
547,543,UC Berkeley
7173,543,"UC Berkeley, Berkeley, CA"
5769,543,"UC Berkeley, Berkeley, CA, USA"
8667,543,"UC Berkeley, Berkeley, USA"
7458,543,"UC Berkeley, CS Division"
1867,543,"UC Berkeley, EECS Dept. Berkeley, CA"
4832,4832,UC Davis
554,1027,UC Riverside
2835,7987,UC San Diego
2901,7987,"UC San Diego, CA"
5093,7987,"UC San Diego, La Jolla, CA"
528,855,UC Santa Cruz
9658,855,"UC Santa Cruz, Santa Cruz, CA"
5766,855,"UC Santa Cruz, Santa Cruz, USA"
1816,543,"UC, Berkeley"
1360,7987,"UC, San Diego"
234,8888,UCLA
4335,8888,"UCLA Anderson School, Los Angeles, CA"
4524,8888,UCLA Computer Science
1090,8888,"UCLA Computer Science Department, Los Angeles, CA"
8027,8888,"UCLA Computer Science Department, Los Angeles, California, CA"
5394,8888,"UCLA, Los Angeles, CA"
6333,8888,"UCLA, Los Angeles, CA, USA"
2223,7987,UCSD
5635,7987,"UCSD, San Diego, CA, USA"
625,7856,UIUC
5521,7856,"UIUC, Urbana, IL"
3567,532,UM Ann Arbor
4871,6912,UMass Amherst
156,156,"UMass Boston, Boston, MA"
6750,156,"UMass/Boston, Dept. of CS, UMass/Boston, Boston, MA"
4843,8017,UNC Chapel Hill
6745,1734,"Univ British Columbia, 2366 Main Mall, UBC, Vancouver, BC"
1293,543,"Univ. California, Berkeley"
7587,6554,"Univ. degli Studi di Torino, Torino, Italy"
7614,7794,"Univ. di Milano, Milan, Italy"
7615,8871,"Univ. di Torino, Torino, Italy"
122,1734,Univ. of British Columbia
7582,1734,"Univ. of British Columbia, Vancouver, B.C., Canada"
7606,8823,"Univ. of Buffalo, Buffalo, NY"
4848,1027,"Univ. of California Riverside, Riverside, CA"
4810,855,Univ. of California Santa Cruz
8983,543,"Univ. of California, Berkeley EECS"
7603,543,"Univ. of California, Berkeley, IBM Almaden Research Center, San Jose, CA"
2467,1027,"Univ. of California, Riverside"
7565,7987,"Univ. of California, San Diego La Jolla, CA"
460,8057,"Univ. of Illinois at Chicago, Chicago, IL"
4792,7856,"Univ. of Illinois, Urbana-Champaign"
461,1416,"Univ. of Louisiana at Lafayette, Lafayette, LA"
3343,1451,Univ. of Maryland
7600,1451,"Univ. of Maryland, College Park"
7577,6912,"Univ. of Massachusetts, Amherst"
688,9351,Univ. of Melbourne
300,532,Univ. of Michigan
7578,1603,"Univ. of Munich, Munich, Germany"
7575,7575,"Univ. of Passau, Passau, Germany"
6512,6752,Univ. of Pennsylvania
4175,6684,"Univ. of Rome, """"La Sapienza"""""
3205,7591,Univ. of Texas at Arlington
2468,7591,"Univ. of Texas, Arlington"
7611,9332,"Univ. of Tokyo, Tokyo, Japan"
689,8170,Univ. of Toronto
1022,8170,"Univ. of Washington, Seattle"
4406,8170,"Univ. of Washington, Seattle, WA"
7732,8170,Univ. of Washington; E-mail: alon@cs.washington.edu
7607,8748,"Univ. of Waterloo, Waterloo, Ont. Canada"
7090,8125,Univ. of Wisconsin-Madison
7180,8125,"Univ. of Wisconsin-Madison, Madison, WI"
1019,8125,"Univ. of Wisconsin, Madison"
2256,2256,Univ. Paris Dauphine
476,2095,Univ. Paris XI
2862,2095,"Univ. Paris-Sud, France"
4486,4486,Univ. Politecnica de Madrid
2259,6256,Univ. Santa Clara
2863,2863,"Univ. Versailles-Saint-Quentin, France"
9074,8125,Univ. Wisconsin Madison
2899,8125,"Univ. Wisconsin, Madison"
5158,8356,"Univerisity of California, Santa Barbara, CA"
5066,2131,"Univeristy of New South Wales, Australia"
1761,1761,"Universidad de Buenos Aires, Departamento de Computación"
9406,7790,"Universidad de Chile, Chile"
8261,7790,"Universidad de Chile, Chile, C. P"
7906,4486,"Universidad Politécnica de Madrid (UPM), Madrid, Spain"
9288,4486,"Universidad Politécnica de Madrid, Spain"
8396,1778,"Universidade Federal do Rio de Janeiro, Rio de Janeiro-RJ, Brazil"
8398,1778,"Universidade Federal do Rio Grande do Sul, Brazil"
4705,6684,"Università """"La Sapienza"""", Roma, Italy"
9708,6667,"Università della Basilicata -- Potenza, Italy"
7226,6667,"Università della Basilicata, c.da Macchia Romana, 85100 Potenza, Italy"
2128,6667,"Università della Basilicata, Potenza, Italy"
4696,1353,"Università della Calabria, Rende, Italy"
2231,7794,"Università di Milano, Crema - Italy"
5634,8741,"Universita di Pisa, Pisa, Italy"
184,6684,"Università di Roma """"La Sapienza"""""
622,6684,"Universita di Roma """"La Sapienza"""", Roma, Italy"
7813,6684,"Università di Roma “La Sapienza”, Dipartimento di Informatica e Sistemistica, Via Salaria 113, 00198 Roma, Italy; E-mail: mecella@dis.uniromA1.it"
7597,6664,Universita di Roma Tre
5535,8871,"Università di Torino, Torino, Italy"
8961,6664,Università Roma Tre
9709,6664,"Università Roma Tre -- Roma, Italy"
2127,6664,"Università Roma Tre, Roma, Italy"
8879,6664,"Università Roma Tre, Rome, Italy"
7225,6664,"Università Roma Tre, Via della Vasca Navale, 79 00149 Roma, Italy"
6206,6667,"Universitàà della Basilicata, Potenza, Italy"
8489,8550,"Universität des Saarlandes, Saarbrücken, Germany"
3035,7945,"Universität Karlsruhe (TH), Germany"
7875,7875,"Universität Leipzig, Institut für Informatik, 04109 Leipzig, Germany; (e-mail: rahm@informatik.uni-leipzig.de)"
8583,1688,"Universität Magdeburg, Germany"
4576,530,"Universität Mannheim, Mannheim, Germany"
7704,530,"Universität Mannheim; e-mail: [mildenbe|rschiele]@uni-mannheim.de, [helmer|moerkotte]@informatik.uni-mannheim.de"
7869,7869,"Universität Münster, Institut für Wirtschaftsinformatik, Leonardo-Campus 3, 48149 Münster, Germany; e-mail: {lechten,vossen}@helios.uni-muenster.de"
1257,7575,"Universität Passau, Fakultät für Mathematik und Informatik, Passau, Germany"
7754,7575,"Universität Passau, Lehrstuhl für Informatik, 94030 Passau, Germany; E-mail: {claussen,kemper,kossmann,wiesner}@db.fmi.uni-passau.de"
7820,7575,"Universität Passau, Lehrstuhl für Informatik, 94030 Passau, Germany; E-mail: <lastname>@db.fmi.uni-passau.de"
1190,7575,"Universität Passau, Passau, Germany"
2157,2157,"Universitat Politècnica de Catalunya, Barcelona, Caalonia, Spain"
2156,2157,"Universitat Politècnica de Catalunya, Barcelona, Catalonia, Spain"
6378,1965,"Universität Tübingen, Tübingen, Germany"
8254,8254,"Université de Mons-Hainaut, Mons, Belgium"
2491,2491,Université de Nantes
7870,2095,"Université de Paris-Sud, LRI, CNRS-UMR 8623, Bât. 490, 91405 Orsay, France; e-mail: spyratos@lri.fr"
6535,2095,"Université Paris 9 (Dauphine), Pl. du Mal de Lattre, Paris 75016, France"
8255,2256,"Université Paris Dauphine, Paris, France"
9785,2095,"Université Paris-Sud, France"
8607,8607,"University at Albany, State University of New York, Albany, NY"
4680,8607,"University at Albany, SUNY, Albany, NY"
7972,8823,"University at Buffalo, Buffalo, New York"
3168,8823,"University at Buffalo, Buffalo, NY"
8593,8823,"University at Buffalo, State University of New York, Buffalo, NY"
3935,7655,University Freiburg
3928,6673,University Marburg
5531,783,"University of Aberdeen, United Kingdom"
9148,7788,University of Alberta
1434,7788,"University of Alberta, Department of Computing Science, Edmonton, Alberta, Canada"
273,7788,"University of Alberta, Edmonton, Alberta, Canada"
7596,7596,University of Antwerp
8451,7596,"University of Antwerp, Antwerp, Belgium"
7646,7596,"University of Antwerp, Wilrijk, Belgium"
7038,6775,University of Arizona
3659,6775,University of Arizona at Tucson
8301,6775,"University of Arizona, AZ"
1839,6775,"University of Arizona, Department of Computer Science, Tucson, AZ"
60,6775,"University of Arizona, Tucson, AZ"
5839,6775,"University of Arizona, Tucson, AZ, USA"
5645,7572,"University of Athens, Athens, Greece"
9384,7572,"University of Athens, Athens, Greece 15771"
8611,7572,"University of Athens, Athens, Greece 15784"
4050,7572,"University of Athens, Hellas"
3546,1041,University of Augsburg
3926,6667,University of Basilicata
3641,8865,University of Bologna
1080,1734,University of British Columbia
7712,1734,"University of British Columbia, 201-2366 Main Mall, Vancouver, BC V6T 1Z4, Canada; e-mail: laks@cs.ubc.ca"
407,1734,"University of British Columbia, Canada"
7240,1734,"University of British Columbia, Vancouver, B. C., Canada"
8449,1734,"University of British Columbia, Vancouver, B.C., Canada"
7695,1734,"University of British Columbia, Vancouver, BC, Canada; e-mail: laks@cs.ubc.ca"
3993,1734,"University of British Columbia, Vancouver, CA"
4136,1734,"University of British Columbia, Vancouver, Canda"
7760,1734,University of British Columbia; E-mail: rng@cs.ubc.ca
3564,1761,University of Buenos Aires
29,29,University of Calgary
4422,29,"University of Calgary, Calgary, AB, Canada"
1518,1027,University of California
1061,1027,"University of California - Riverside, Computer Science & Engineering Department, Riverside, CA"
1005,543,University of California at Berkeley
5224,543,"University of California at Berkeley, Berkeley, CA"
6064,543,"University of California at Berkeley, Berkeley, CA, USA"
3695,4832,University of California at Davis
6389,4832,"University of California at Davis, Davis, CA, USA"
7621,6779,University of California at Irvine
3937,8888,University of California at Los Angeles
3856,1027,University of California at Riverside
8117,7987,"University of California at San Diego, La Jolla, CA"
3202,8356,University of California at Santa Barbara
1492,8356,"University of California at Santa Barbara, Computer Science Department, Santa Barbara"
2732,8356,"University of California at Santa Barbara, Santa Barbara, CA"
7663,855,"University of California at Santa Cruz, Santa Cruz, CA"
3486,6779,University of California Irvine
6436,6779,"University of California Irvine, Irvine, CA, USA"
3323,8888,"University of California Los Angeles, Los Angeles"
2305,8888,"University of California Los Angeles, Los Angeles, CA"
633,1027,University of California Riverside
1365,7987,University of California San Diego
6435,7987,"University of California San Diego, La Jolla, CA, USA"
5542,7987,"University of California San Diego, San Diego, CA"
4490,8356,"University of California Santa Barbara, Santa Barbara, CA"
5779,8356,"University of California Santa Barbara, Santa Barbara, CA, USA"
4048,855,University of California Santa Cruz
6144,855,"University of California Santa Cruz, Santa Cruz, CA, USA"
1385,543,"University of California, Berkeley"
6486,543,"University of California, Berkeley CA"
7594,543,"University of California, Berkeley, Berkeley, CA"
6278,543,"University of California, Berkeley, Berkeley, CA, USA"
7973,543,"University of California, Berkeley, Berkeley, California"
3016,543,"University of California, Berkeley, CA"
7689,543,"University of California, Berkeley, California"
7765,543,"University of California, Berkeley, Computer Science Division, Berkeley, CA 94720-1776, USA; E-mail: {rshankar,bhaskar,jmh}@cs.berkeley.edu"
2360,4832,"University of California, Davis"
7866,8356,"University of California, Davis, Department of Computer Science, One Shields Avenue, Davis, CA 95616, USA; E-mail: gertz@cs.ucdavis.edu"
117,6779,"University of California, Irvine"
2280,6779,"University of California, Irvine, CA"
1905,6779,"University of California, Irvine, Irvine, CA"
5640,6779,"University of California, Irvine, Irvine, CA, USA"
6220,6779,"University of California, Irvine, Irvine, California, USA"
8814,1027,"University of California, Irvine, USA"
8554,8888,"University of California, Los Angeles, CA"
7970,8888,"University of California, Los Angeles, California"
196,1027,"University of California, Riverside"
56,1027,"University of California, Riverside, CA"
5366,1027,"University of California, Riverside, Riverside, CA"
8728,1027,"University of California, Riverside, USA"
1124,7987,"University of California, San Diego"
3531,7987,"University of California, San Diego La Jolla, CA"
9779,8356,"University of California, San Diego, CA"
135,7987,"University of California, San Diego, La Jolla, CA"
1982,8356,"University of California, Santa Barbara"
45,8356,"University of California, Santa Barbara, CA"
8411,8356,"University of California, Santa Barbara, Santa Barbara, CA"
5651,8356,"University of California, Santa Barbara, Santa Barbara, CA, USA"
9310,8356,"University of California, Santa Barbara, USA"
1956,855,"University of California, Santa Cruz"
8482,8356,"University of California, Santa Cruz, CA"
8273,855,"University of California, Santa Cruz, Santa Cruz, CA"
5977,855,"University of California, Santa Cruz, Santa Cruz, CA, USA"
7998,855,"University of California, Santa Cruz, Santa Cruz, California"
8359,543,"University of California, USA"
5311,6779,"University of California: Irvine, Irvine, CA"
5501,8356,"University of California: Santa Barbara, Santa Barbara, CA"
7361,1925,"University of Cambridge, Cambridge, UK"
8134,8134,"University of Camerino, Italy"
1130,6583,University of Central Florida
4911,6583,"University of Central Florida, Orlando, FL"
8308,8819,"University of Central Oklahoma, Edmond, OK"
3445,6509,University of Crete
8392,536,"University of Dortmund, Dortmund, Germany"
563,1853,University of Edinburgh
5232,1853,"University of Edinburgh & Bell Laboratories, Edinburgh, Scotland UK"
5172,1853,"University of Edinburgh & Bell Laboratories, Edinburgh, United Kingdom"
7995,1853,"University of Edinburgh, Edinburgh, Scotland"
5233,1853,"University of Edinburgh, Edinburgh, Scotland UK"
429,1853,"University of Edinburgh, Edinburgh, UK"
5993,1853,"University of Edinburgh, Edinburgh, United Kngdm"
8705,1853,"University of Edinburgh, Scotland"
8208,1853,"University of Edinburgh, Scotland, UK"
438,763,University of Florida
4527,763,"University of Florida, Gainesville"
222,763,"University of Florida, Gainesville, FL"
5723,763,"University of Florida, Gainesville, FL, USA"
8779,763,"University of Florida, Gainesville, Gainesville, FL"
3524,763,"University of Florida, Gainesville, USA"
3661,7655,University of Freiburg
3266,7655,"University of Freiburg, Georges-Köhler-Allee, Freiburg, Germany"
491,8134,"University of Genoa, Genoa, Italy"
4513,8134,"University of Genova, Italy"
3650,7681,University of Glasgow
3362,1428,University of Halle
7242,1428,"University of Halle, Germany"
472,462,University of Hannover
5010,5010,"University of Heidelberg, Germany"
6390,5010,"University of Heidelberg, Heidelberg, Germany"
8072,5010,"University of Heidelberg, Institut für Informatik, Germany"
4865,1854,University of Helsinki
8286,1451,"University of Helsinki, Finland"
2419,8992,University of Hong Kong
120,8992,"University of Hong Kong, Hong Kong"
5554,8992,"University of Hong Kong, Hong Kong, Hong Kong"
7083,8992,"University of Hong Kong, Pokfulam Road, Hong Kong"
5382,5382,"University of Houston, Houston, TX"
6403,5382,"University of Houston, Houston, TX, USA"
5703,7856,"University of Ilinois at Urbana Champaign, Urbana, IL, USA"
296,7856,University of Illinois
3078,8057,University of Illinois at Chicago
