record_id,label_true,affiliation
953,5136,"Dresden University of Technology, Software Engineering Group, Dresden, Germany"
4842,7880,Drexel University
6934,7794,"DSI-Università di Milano, Via Comelico, 39/41, 20135 Milano Italy"
6933,7794,"DSI-Università di Milano, Via Comelico, 39/41, 20135 Milano, Italy"
1086,7794,"DSI, Università di Milano, Italy"
604,8151,Duke University
2456,8151,"Duke University, Durham, NC"
6009,8151,"Duke University, Durham, NC, USA"
3344,8151,"Duke University, Durham, North Carolina"
8469,8511,"E-Health Research Centre/CSIRO ICT, Australia"
6756,6756,"E.piphany, Inc."
1411,1411,"Ecole Nationale Superieure, de Telecommunications, Paris, France"
581,1411,"École Normale Supérieure de Paris, France"
8941,8884,"Ecole Polytechnique Fédéral de Lausanne & Google, LTAA, Lausanne, Switzerland"
8940,8884,"Ecole Polytechnique Fédéral de Lausanne, LTAA, Lausanne, Switzerland"
205,8884,"Ecole Polytechnique Fédérale de Lausanne (EPFL), Lausanne, Switzerland"
2927,8884,"École Polytechnique Fédérale de Lausanne, Lausanne, Switzerland"
3133,8884,"École Polytechnique Fédérale de Lausanne, Switzerland"
1403,543,"EECS Computer Science Division, UC Berkeley"
903,543,"EECS Computer Science Division, University of California Berkeley, Berkeley, CA"
7893,2179,"EECS Department, Tufts University, Medford, MA"
1795,543,"EECS Department, UC Berkeley"
966,32,"EECS Dept, Case Western Reserve University, Cleveland, Ohio"
2167,543,"EECS Dept., UC Berkeley"
8448,8448,"Eindhoven Technical University, Eindhoven, The Netherlands"
1119,532,"Electrical Engineering and Computer Science, University of Michigan, Ann Arbor, MI"
9262,532,"Electrical Engineering and Computer Science, University of Michigan, Ann Arbor, USA 48109"
1340,6969,"Electrical Engineering Department, National Taiwan University, Taipei, Taiwan, ROC"
8763,9345,"Electrical Engineering Department, National Taiwan University, Taipei, Taiwan, ROC and Department of Engineering Science, National Cheng Kung University, Tainen city, Taiwan, ROC 701"
955,955,"Embedded System Technology Group, Information Technology Lab., LG Electronics Institute of Technology, Seocho-Gu, Seoul, Korea"
7962,7962,"Embrapa - Brazilian Agricultural Research Corporation, Av. Dr. Andre Torsello, 209, SP, 13083-886, Campinas, Brazil"
8590,9428,"Emory University, Atlanta, GA"
3034,8884,EPFL
5739,8884,"EPFL, Lausanne, Switzerland"
3005,8884,"EPFL, Switzerland"
6585,6756,"Epiphany Inc., Palo Alto, CA"
3576,6756,"Epiphany, USA"
1303,1640,ETH Zurich
2625,1640,"ETH Zurich, CH"
7345,1640,"ETH Zürich, CH 8092 Zürich, Switzerland"
308,1640,"ETH Zurich, Switzerland"
182,1640,"ETH Zurich, Zurich"
607,1640,"ETH Zurich, Zurich, Switzerland"
8746,1640,"ETH Zurich, Zurich, Switzerland 8092"
1198,7156,"European Organization for Nuclear Research (CERN), Geneva, Switzerland"
9768,9768,Facebook Data Infrastructure Team
5881,9768,"Facebook, Palo Alto, CA, USA"
6520,6673,Fachbereich Mathematik und Informatik Universität Marburg - Germany
6530,8125,faculty at the University of Wisconsin-Madison
772,772,"Faculty of Computer Science, Free University of Bozen-Bolzano, Bolzano, Italy"
9460,7872,"Faculty of EEMCS, University of Twente, Enschede, The Netherlands 7500AE"
9499,9499,"Faculty of Mathematics and Computer Science, University of Hagen, Hagen, Germany 58084"
1487,530,"Fakultät für Mathematik und Informatik, University of Mannheim, Germany"
7568,9499,FernUniv. Hagen
8284,9499,"FernUniversität Hagen, Hagen, Germany"
4867,4867,FIU
9100,4867,Florida International University
5094,4867,"Florida International University, Miami, FL"
6392,4867,"Florida International University, Miami, FL, USA"
3378,4867,"Florida International University, University Park, Miami, FL, USA"
9399,9399,"Florida State University, Tallahassee, FL"
6135,9399,"Florida State University, Tallahassee, FL, USA"
5764,9399,"Florida State University, Tallahassee, USA"
7945,7945,"Forschungszentrum Informatik (FZI), University of Karlsruhe, 76131, Karlsruhe, Germany"
3532,1140,FORWISS
8141,8141,"France Telecom R&D , France"
8530,772,"Free University of Bozen-Bolzano, Bozen-Bolzano BZ, Italy"
892,772,"Free University of Bozen-Bolzano, Bozen-Bolzano, Italy"
86,772,"Free University of Bozen-Bolzano, Bozen, Italy"
2087,772,"Free University of Bozen-Bolzano, Faculty of Computer Science, Italy"
1178,1178,Fudan University
4516,1178,"Fudan University, China"
915,1178,"Fudan University, Shanghai, China"
7613,7785,"George Mason Univ., Fairfax. VA"
264,7785,George Mason University
2233,7785,"George Mason University, Fairfax, VA"
7900,7785,"George Mason University, Fairfax, Virginia"
6373,7785,"George Mason University, Fairfax, VT, USA"
6076,6076,"George Washington University, Washington D.C., DC, USA"
6449,6076,"George Washington University, Washington, D.C., DC, USA"
3012,6634,Georgia Institute of Technology
7840,6634,"Georgia Institute of Technology, 30332 Atlanta, GA, USA"
6927,6634,"Georgia Institute of Technology, Atlanta, GA"
5864,6634,"Georgia Institute of Technology, Atlanta, GA, USA"
6712,6634,"Georgia Institute of Technology, College of Computing"
8410,6634,"Georgia State University, Atlanta, GA"
3596,6634,Georgia Tech
6482,9768,"Gigabeat, Inc. Palo Alto CA"
9331,9332,"Global Scientific Information and Computing Center, Tokyo Institute of Technology, Tokyo, Japan 152-8552"
2551,2551,Google
776,2551,Google Inc.
2401,2551,"Google Inc., Mountain View, CA"
5771,2551,"Google Inc., Mountain View, CA, USA"
2322,2551,"Google Inc., Mountain View, California"
8644,2551,"Google Inc., Mountain View, USA"
8798,2551,"Google Inc., Mountain View, USA 94043"
3337,2551,"Google, Inc."
3297,2551,"Google, Inc., Mountain View, CA"
6411,2551,"Google, Inc., Mountain View, CA, USA"
9432,2551,"Google, Inc., Mountain View, USA 94043"
8855,2551,"Google, Inc., New York, NY"
5774,2551,"Google, Mountain View, CA, USA"
9600,9600,Greenplum
6277,9600,"Greenplum Inc., San Mateo, CA, USA"
4837,4837,Haifa University
8599,4837,"Haifa University, Haifa, Israel"
8910,4837,"Haifa, Israel"
9020,9306,Harbin Institute of Tech.
3111,9306,Harbin Institute of Technology
42,9306,"Harbin Institute of Technology, China"
3038,9306,"Harbin Institute of Technology, Harbin, China"
2655,2655,"Hasso-Plattner-Institut, Potsdam"
2744,2655,"Hasso-Plattner-Institut, Potsdam, Germany"
393,393,Hebrew University
9458,9458,"Hebrew University of Jerusalem, Jerusalem, Israel"
5491,393,"Hebrew University, Jerusalem, Israel"
1212,1212,"HeliXense Pte Ltd, Singapore"
1210,1212,"HeliXense Pte Ltd., Singapore"
8285,8173,"Helsinki University of Technology, HUT, Finland"
5198,5198,"Hewlett Packard Laboratories, Palo Alto, CA"
6056,5198,"Hewlett Packard Laboratories, Palo Alto, CA, USA"
1218,5198,"Hewlett Packard, Palo Alto, CA"
6940,5198,"Hewlett-Packard Company, 1501 Page Mill Road, Palo Alto, CA"
805,805,"Hewlett-Packard Company, Houston, TX"
320,805,"Hewlett-Packard Company, Tomball Parkway, Houston, TX"
2140,5198,"Hewlett-Packard Laboratories, Palo Alto, CA"
6471,5198,"Hewlett-Packard Laboratories, Palo Alto, California"
3755,5198,Hewlett-Packard Labs
2488,5198,"Hewlett-Packard Labs, Palo Alto, CA"
1185,5198,"Hewlett-Packard, Palo Alto, CA"
9441,9441,"Highbridge Capital Management LLC, USA"
5678,9441,"Highbridge Capital Management LLC, USA, USA"
3372,1810,HKUST
4140,1810,"HKUST, Clear Water bay, Hong Kong"
5403,1810,"HKUST, Hong Kong, China"
4502,4502,Hong Kong Baptist University
5083,4502,"Hong Kong Baptist University, Hong Kong"
268,268,"Hong Kong Polytechnic University, Hung Hom, Hong Kong"
8558,268,"Hong Kong Polytechnic University, Kowloon, Hong Kong"
5676,1810,"Hong Kong Univ. of Science and Technology, Hong Kong, China"
4501,1810,Hong Kong University of Science & Technology
3826,1810,"Hong Kong University of Science & Technology, Hong Kong, China"
3244,1810,Hong Kong University of Science and Technology
41,1810,"Hong Kong University of Science and Technology, China"
2236,1810,"Hong Kong University of Science and Technology, Clear Water Bay, Hong Kong"
4795,1810,"Hong Kong University of Science and Technology, Clear Water Bay, Kowloon, Hong Kong"
3260,1810,"Hong Kong University of Science and Technology, Hong Kong"
2323,1810,"Hong Kong University of Science and Technology, Hong Kong, China"
5325,1810,"Hong Kong University of Science and Technology, Hong Kong, Hong Kong"
5604,1810,"Hong Kong University of Science and Technology, Kowloon, Hong Kong"
6166,8992,"Hong Kong University, Hong Kong, Hong Kong"
9057,5198,"HP Laboratories, Palo Alto, CA"
2530,5198,"HP Labs, Palo Alto, CA"
5805,5198,"HP Labs, Palo Alto, CA, USA"
3419,5198,"HP, Palo Alto, CA, USA"
3242,1810,"Huazhong University of Science and Technology, Hong Kong"
3241,1810,"Huazhong University of Science and Technology, Wuhan, China"
1764,1764,"Humboldt Universität zu Berlin, Berlin, Germany"
1278,1764,"Humboldt-Universität und Fachhochschule für Technik und Wirtschaft, Germany"
3079,1764,Humboldt-Universität zu Berlin
4488,1764,"Humboldt-Universität zu Berlin, Berlin, Germany"
388,1764,"Humboldt-Universität zu Berlin, Germany"
1277,1277,"Humboldt-Universität zu Berlin, Kelman GmbH, Berlin, Germany"
5240,1764,"Humboldt-University zu Berlin, Berlin, Germany"
310,310,"i-TV-T AG, Germany"
180,310,"i-TV-T AG, Unterföhring"
2596,7930,I.I.T. Bombay
4664,7953,"I.N.R.I.A. Rocquencourt, Cedex, France"
7676,7953,"I.N.R.I.A., Rocquencourt, France; e-mail: &lcub;Vincent.Aguilera,Pierangelo.Veltri&rcub;&commat;inria.fr"
3969,3969,IBM
3276,7927,IBM Almaden
2900,7927,"IBM Almaden RC, San Jose, CA"
9064,7927,IBM Almaden Res. Ctr.
38,7927,IBM Almaden Research Center
6549,7927,"IBM Almaden Research Center San Jose , CA"
6588,7927,"IBM Almaden Research Center, 650 Harry Road, San Jose, CA"
7849,7927,"IBM Almaden Research Center, 650 Harry Road, San Jose, CA 95120, USA; E-mail: {shanmuga, shekita, bgl, pirahesh, reinwald}@almaden.ibm.com; barr@cs.cornell.edu; carey@propel.com"
6150,7927,"IBM Almaden Research Center, San Jos, CA, USA"
6440,7927,"IBM Almaden Research Center, San Jose , CA, USA"
1715,7927,"IBM Almaden Research Center, San Jose CA"
15,7927,"IBM Almaden Research Center, San Jose, CA"
3865,7927,"IBM Almaden Research Center, San Jose, CA, USA"
681,7927,"IBM Almaden Research Center, San Jose, California"
5767,7927,"IBM Almaden Research Center, San Jose, USA"
9338,7927,"IBM Almaden Research Center, San Jose, USA 95120"
8069,7927,"IBM Almaden Research Center, USA"
5371,7927,"IBM Almaden Research Lab, San Jose, CA"
8853,7927,"IBM Almaden Research, Almaden, CA"
7139,7927,"IBM Almaden Research, Center"
2886,7927,"IBM Almaden Research, San Jose, CA"
1856,7927,"IBM Almaden, Research Center, San Jose, CA"
5574,7927,"IBM Almaden, San Jose, CA, USA"
878,878,"IBM Boeblingen Lab, Böblingen, Germany"
5062,878,"IBM Boeblingen Laboratory, Boeblingen, Germany"
6904,6904,"IBM Canada Ltd., 1150 Eglinton Ave. E., Toronto, Ontario M3C 1H7, Canada"
3867,6904,"IBM Canada, Toronto, ON, Canada"
5889,5889,"IBM China Research Lab, BeiJing, China"
9721,5889,"IBM China Research Lab, China"
6210,5889,"IBM China Research Laboratory, Beijing, China"
2706,5889,"IBM China Research Laboratory, ShangDi, Beijing, China"
7162,3969,"IBM Corporation, San Jose, CA"
7186,3969,"IBM Database Tech. Inst., Austin, TX"
2376,878,"IBM Deutschland, Böblingen, Germany"
1600,878,"IBM Entwicklung GmbH, Böblingen, Germany"
110,4052,IBM Germany
8439,9284,"IBM Germany, Boeblingen"
2902,878,"IBM Germany, Germany"
8368,8368,"IBM Haifa Labs, Israel"
8931,8368,"IBM Haifa Research Lab, Haifa, Israel"
9522,9522,"IBM India Research Lab, India"
699,699,"IBM India Research Lab, New Delhi, India"
612,699,"IBM India Research Lab, SIRC"
963,9522,"IBM India Research Lab., Hauz Khas, New Delhi, India"
4126,699,IBM Indian Research Laboratory
2005,3969,IBM Portland
555,6718,IBM Research
8022,8368,"IBM Research Laboratory, Haifa, Israel"
3447,8368,"IBM Research, Haifa, Israel"
4424,699,"IBM Research, New Delhi, India"
8861,6718,"IBM Research, Yorktown Heights, NY"
8444,7927,IBM San Jose CA USA
111,7927,IBM Silicon Valley Lab
4456,7927,"IBM Silicon Valley Lab, San Jose CA"
350,7927,"IBM Silicon Valley Lab, San Jose, CA"
9429,7927,"IBM Silicon Valley Lab, San Jose, USA 95141"
8442,7927,"IBM Silicon Valley Lab, USA"
7055,7927,"IBM Silicon Valley Lab., San Jose, CA"
7356,7927,IBM Silicon Valley Laboratory
1579,7927,"IBM Silicon Valley Laboratory, San Jose, CA"
4606,7927,"IBM Silicon Valley Laboratory, San Jose, California"
4601,7927,IBM Silicon Valley Labs
7141,7927,"IBM Silicon Valley, Laboratory"
5837,7927,"IBM Sillicon Valley Lab, San Jose, CA, USA"
9524,9524,IBM Software Group
9725,6904,"IBM Software Group, Canada"
9526,699,"IBM Software Group, India"
7125,699,"IBM Software Lab, India, Golden Enclave, Bangalore 560017 India"
627,6718,IBM T. J. Watson Res. Center
448,6718,IBM T. J. Watson Research Center
682,6718,"IBM T. J. Watson Research Center, Hawhorne, NY"
1068,6718,"IBM T. J. Watson Research Center, Hawthorne NY"
2038,2038,"IBM T. J. Watson Research Center, Hawthorne, New York"
363,2038,"IBM T. J. Watson Research Center, Hawthorne, NY"
5583,2038,"IBM T. J. Watson Research Center, Hawthorne, NY, USA"
6762,6718,"IBM T. J. Watson Research Center, P.O. Box 704, Yorktown Heights, NY"
7098,2038,"IBM T. J. Watson Research Center, Road, Hawthorne, NY"
5656,6718,"IBM T. J. Watson Research Center, Westchester, NY, USA"
263,6718,"IBM T. J. Watson Research Center, Yorktown Heights, NY"
6254,6718,"IBM T. J. Watson Research Center, Yorktown Heights, NY, USA"
1342,6718,"IBM T. J. Watson Research Center, Yorktown, NY"
1837,2038,"IBM T. J. Watson Research, Hawthorne, NY"
4109,6718,"IBM T. J. Watson, Research Center"
791,6718,IBM T.J. Watson Research Center
2330,2038,"IBM T.J. Watson Research Center Hawthorne, NY"
7422,2038,"IBM T.J. Watson Research Center, Hawthorne, New York"
2573,2038,"IBM T.J. Watson Research Center, Hawthorne, NY"
9315,2038,"IBM T.J. Watson Research Center, Hawthorne, USA"
8896,6718,"IBM T.J. Watson Research Center, New York"
8163,6718,"IBM T.J. Watson Research Center, USA"
6490,6718,"IBM T.J. Watson Research Center, Yorktown Heights, NY"
8737,6718,"IBM T.J. Watson Research Center, Yorktown Heights, USA"
2268,2038,"IBM T.J. Watson Research Ctr., Hawthorne, NY"
9341,6718,"IBM T.J. Watson Research Labs, Yorktown Heights, USA 10598"
2065,2038,"IBM T.J. Watson Research, Hawthorne, NY"
5636,6718,"IBM T.J. Watson Research, Hawthorne, NY, USA"
7287,2038,"IBM Thomas J. Watson Research Center, Hawthorne, NY"
5860,2038,"IBM Thomas J. Watson Research Center, Hawthorne, NY, USA"
8765,6718,"IBM Thomas J. Watson Research Centre, Yorktown, USA 10598"
816,6718,IBM TJ Watson Research Center
7609,7609,"IBM Tokyo Research Lab, Tokyo, Japan"
2725,7609,IBM Tokyo Research Laboratory
4161,6904,IBM Toronto
2031,6904,"IBM Toronto Development Lab, Markham, ON, Canada"
4740,6904,"IBM Toronto Development Laboratory, Markham, ON, Canada"
4737,6904,"IBM Toronto Development Laboratory, ON, Canada"
2056,6904,IBM Toronto Lab
2610,6904,"IBM Toronto Lab, Markham, ON"
1974,6904,"IBM Toronto Lab, Markham, ON, Canada"
7036,6904,"IBM Toronto Lab, Markham, Ontario, Canada"
4158,6904,"IBM Toronto Lab, Toronto, Canada"
5800,6904,"IBM Toronto Lab, Toronto, ON, Canada"
3710,6904,IBM Toronto Laboratories
1572,6904,"IBM Toronto Laboratories, Markham, Ontario, Canada"
1999,6904,IBM Toronto Laboratory
2037,6904,"IBM Toronto Laboratory, Markham, Ontario, Canada"
9593,6904,"IBM Toronto Labs, Markham, Ontario, Canada"
1184,6904,"IBM Toronto Software Lab., Markham, Ontario, Canada"
1980,6904,"IBM Toronto Software Laboratory, Markham, Ontario, Canada"
4951,6718,IBM Watson
2356,6718,IBM Watson Research Center
4266,2038,"IBM Watson Research Center, Hawthorne, NY"
9016,2038,"IBM Watson, Hawthorne, NY"
2727,7609,IBM Yamato Software Laboratory
5340,5889,"IBM, Beijing, China"
6892,2038,"IBM, Hawthorne"
5339,7927,"IBM, San Jose, CA"
5780,7927,"IBM, San Jose, CA, USA"
7434,7927,"IBM, San Jose, California"
5675,6904,"IBM, Toronto, Canada"
1355,1355,"ICAR - CNR, Rende, Italy"
1621,1355,Icar CNR
406,1355,"Icar CNR, Italy"
9245,1355,"ICAR-CNR, Rende (CS), Italy"
5346,5346,"IIIT-H: Hyderabad, Hyderabad, India"
237,7930,IIT Bombay
3069,7930,"IIT Bombay, India"
3994,7930,"IIT Bombay, Mumbaî, India"
6821,7930,IIT-Bombay
1121,7930,"IIT, Bombay"
381,7021,"Indian Institute of Science, Bangalore, India"
3619,7930,Indian Institute of Technology Bombay
202,7930,"Indian Institute of Technology Bombay, Mumbai, India"
8041,7930,"Indian Institute of Technology---Mumbai, Mumbai, India"
7022,7930,"Indian Institute of Technology-Bombay, Powai, Mumbai, India"
132,7930,"Indian Institute of Technology, Bombay"
779,7930,"Indian Institute of Technology, Bombay, India"
7864,7930,"Indian Institute of Technology, Bombay, India; E-mail: sunita@it.iitb.ac.in"
4481,7930,"Indian Institute of Technology, Bombay, Powai, Mumbai"
5076,7930,"Indian Institute of Technology, Mumbai, India"
8207,7930,"Indian Institute of Technology, New Delhi, India"
4694,842,Indiana University at Bloomington
5222,842,"Indiana University, Bloomington, IN"
2795,2795,"Infobright Inc., Canada"
2793,2793,"Infobright Inc., Poland"
6258,2795,"Infobright Inc., Toronto, Canada"
6257,2793,"Infobright Inc., Warsaw, Poland"
7809,7809,"Infolab, Department of Information Systems and Management, Tilburg University, PO Box 90153, 5000 LE Tilburg, The Netherlands; e-mail: ling&commat;kub.nl"
8540,7809,"INFOLAB, Tilburg University, Tilburg, The Netherlands 5000 LE"
6627,9524,InFomix Software
8504,7572,"Informatics Laboratory, Agricultural University of Athens, Greece"
6682,6682,"Informatik V, RWTH Aachen, Germany"
1811,1811,"Information Management & System, Group Microsoft Research Asia, Beijing, China"
1607,1607,"Information School, Renmin University of China, Beijing, China"
7991,7991,"Information Sciences Institute, University of Southern California, CA 90292, Marina del Rey, USA"
8244,7991,"Information Sciences Institute, University of Southern California, USA"
8029,7991,"Information Sciences Institute, USC, Marina del Rey, California, CA"
6602,3,"Information Sciences Research Center, Bell Laboratories, 600 Mountain Avenue, Murray Hill NJ"
6804,3,"Information Sciences Research Center, Bell Laboratories, Murray Hill, NJ"
8373,8373,"Information Systems Department, University of Maryland Baltimore County, USA"
976,955,"Information Technology Lab., LG Electronics Institute of Technology"
3503,3503,"Informix Software Inc, Los Gatos, USA"
3731,3503,"Informix Software, Los Gatos, CA, USA"
3413,9524,"Informix, Menlo Park, CA, USA"
1300,7953,INRIA
3770,7953,INRIA  Rocquencourt
3823,7953,INRIA - CNAM
475,475,INRIA Futurs
2222,475,"INRIA Futurs, France"
3754,7953,INRIA Lorraine
3407,7953,INRIA Rocquencourt
7793,7953,"INRIA Rocquencourt, 78153 Le Chesnay, France"
1723,7953,"INRIA Rocquencourt, Domaine de Voluceau, Le Chesnay - France"
1496,7953,"INRIA Rocquencourt, France"
2649,7953,"INRIA Rocquencourt, Le Chesnay, France"
6510,7953,"INRIA Rooquencourt, BP 105,78153, Le Chesnay Cedex, France"
7731,7953,INRIA Roquencourt; E-mail: dana@rodin.inria.fr
8295,475,"INRIA-Futurs, Orsay, Orsay Cedex, France"
2687,475,"INRIA-Orsay, France"
1225,7953,"INRIA-Rocquencourt, Le Chesnay Cedex, France"
6607,7953,"INRIA, BP 105, 78153 Le Chesnay, France"
6856,7953,"INRIA, Domaine de Voluceau BP 105, 78153 Le Chesnay Cedex, France"
8025,7953,"INRIA, France"
5148,7953,"INRIA, Nantes, France"
8179,475,"INRIA, Orsay Cedex, France"
7328,7815,INRIA&Tel-Aviv U.
1143,1143,"Institut förmatik, TU-München, Orleansstraße, München, Germany"
1603,1603,"Institut für Informatik, Ludwig-Maximilians-Universität München"
7593,1143,"Institut fur Informatik, Technical University of Munich, Orleanstr. 34, Munich, D-81667, Germany"
2648,1143,"Institut für Informatik, TU München, Germany"
7655,7655,"Institut für Informatik, Universität Freiburg, Freiburg, Germany"
1965,1965,"Institut für Informatik, University of Tübingen, Tübingen, Germany"
9459,8141,"Institut Télécom, Télécom ParisTech, CNRS LTCI, Paris, France"
6459,7945,"Institute AIFB, Universität Karlsruhe, Karlsruhe, Germany"
6697,1451,"Institute for Advanced Computer Studies and Department of Computer Science, University of Maryland, College Park"
6839,1603,"Institute for Computer Science, University of Munich, Oettingenstr. 67, D-80538 München, Germany"
6494,1603,"Institute for Computer Science, University of Munich, Oettingenstr. 67, D-80538 Munich, Germany"
831,7945,"Institute for Program Structures and Data Organisation, Universität Karlsruhe (TH), Karlsruhe, Germany"
1135,7572,"Institute of Communication and Computer Systems and Department of Electrical and Computer Engineering, National Technical University of Athens, Zographou, Athens, Hellas"
8744,7572,"Institute of Communication and Computer Systems and School of Electrical and Computer Engineering, National Technical University of Athens, Athens, Greece 15773"
1485,7572,"Institute of Communication and Computer Systems and School of Electrical and Computer Engineering, National Technical University of Athens, Zographou, Athens, Hellas"
7783,9344,"Institute of Computer Science and Information Engineering, National Chiayi University, Chiayi, Taiwan; E-mail: ychen@sun11.ncytc.edu.tw"
6509,6509,"Institute of Computer Science, Forth, P.O, Box 1385, Heraldion, Greece"
1041,1041,"Institute of Computer Science, University of Augsburg, Augsburg, Germany"
8459,9001,"Institute of Computing Technology, Chinese Academy of Sciences and Graduate School, Chinese Academy of Sciences, Zhongguancun, Beijing, P.R.China"
7963,7962,"Institute of Computing, University of Campinas, Caixa Postal 6176, SP, 13081-970, Campinas, Brazil"
6531,9332,"Institute of Industrial Science, University of Tokyo, JAPAN"
1240,9332,"Institute of Industrial Science, University of Tokyo, Komaba, Meguro-ku, Tokyo"
7781,9345,"Institute of Information Engineering, National Cheng Kung University, Tainan, Taiwan; E-mail: leec@dblab.iie.ncku.edu.tw"
921,921,"Institute of Information Science, Academia Sinica, Taipei, Taiwan"
923,921,"Institute of Information Science, Academia Sinica, Taipei, Taiwan and Department of Computer Science and Information Engineering, National Taiwan University of Science and Technology, Taipei, Taiwan"
4416,1640,"Institute of Information Systems, ETH Zurich, Switzerland"
450,1640,"Institute of Information Systems, ETH Zurich, Zurich, Switzerland"
7735,1764,"Institute of Information Systems, Faculty of Economics, Humboldt University Berlin, 10178 Berlin, Germany; e-mail: myra@wiwi.hu-berlin.de"
167,8884,"Institute of Information Systems, Switzerland"
2154,1314,"Institute of Parallel and Distributed Systems, University of Stuttgart, Stuttgart, Germany"
7734,1764,"Institute of Pedagogy and Informatics, Faculty of Philosophy IV, Humboldt University Berlin, 10117 Berlin, Germany; e-mail: berendt@educat.hu-berlin.de"
4342,9001,"Institute of Remote Sensing Applications, Chinese Academy of Sciences, Beijing"
9461,7872,"Institute of Technical Medicine, Faculty of Science and Technology, University of Twente, Enschede, The Netherlands 7500AE"
1778,1778,"Instituto de Informática, Universidade Federal do Rio Grande do Sul - UFRGS, Brazil"
8887,8887,"Integrated Data System Department, Siemens Corporate Research, Princeton, USA 08540"
2183,723,"Integrated Media Systems Center & Computer Science Department, University of Southern California, Los Angeles, CA"
2780,8425,Intel Corporation
176,8425,"Intel Corporation, Santa Clara, CA"
548,543,Intel Research Berkeley
5486,543,"Intel Research Berkeley, Berkeley, CA"
7509,543,"Intel Research Laboratory, Berkeley, CA"
1698,1698,Intel Research Pittsburgh
246,1698,"Intel Research Pittsburgh, Pittsburgh, PA"
6059,1698,"Intel Research Pittsburgh, Pittsburgh, PA, USA"
2,2,"Intel Research, Berkeley"
8198,543,"Intel Research, Berkeley, CA"
9794,2,"Intel Research, Berkeley, CA, USA"
8000,1698,"Intel Research, Pittsburgh, Pennsylvania, PA"
7934,5346,"International Institute of Information Technology, 5000019, Gachhilbowli, Hyderabad, India"
8266,8266,"ISLA, Universiteit van Amsterdam, The Netherlands"
949,8266,"ISLA, University of Amsterdam, The Netherlands"
5273,5273,"ISTI-CNR, Pisa, Italy"
4350,6779,itr-rescue.org
4349,6779,itr-rescue.org (UC Irvine)
6990,6990,Japan Advanced Institute of Science and Technology
1713,6990,"Japan Advanced Institute of Science and Technology, Asahidai, Tatsunokuchi, Ishikawa, Japan"
7997,8542,"Japan Advanced Institute of Science and Technology, Ishikawa, Japan"
1704,6590,Johns Hopkins University
2955,6590,"Johns Hopkins University, Baltimore, MD"
4838,8542,KAIST
7024,8542,"KAIST, Taejon, KOREA"
1279,1277,"Kelman GmbH Berlin, Berlin, Germany"
170,170,"Kent State University, Kent, OH"
5697,170,"Kent State University, Kent, OH, USA"
9485,1607,"Key Labs of Data Engineering and Knowledge Engineering, MOE, Renmin University of China, Beijing, People's Republic of China"
6256,6256,"Kickfire, Santa Clara, , CA, USA"
6047,6047,"King Abdullah University of Science and Technology, Jedah, Saudi Arabia"
6186,6047,"King Abdullah University of Science and Technology, Soudi Arabia, Saudi Arabia"
3858,8542,Korea Advanced Institute of Science and Technology
92,8542,"Korea Advanced Institute of Science and Technology (KAIST), Daejeon, Korea"
5625,8542,"Korea Advanced Institute of Science and Technology (KAIST), Daejeon, South Korea"
7094,8542,"Korea Advanced Institute of Science and Technology (KAIST), Taejon, Korea"
6587,8542,"Korea Advanced Institute of Science and Technology and Advanced Information Technology Research Center at KAIST, Taejon, KOREA"
7413,8542,"Korea Advanced Institute of Science and Technology, 373-1, Gusong-dong, Yusong-gu, Daejeon 305-701, South Korea"
742,8542,"Korea Advanced Institute of Science and Technology, Daejeon-City, Korea"
5256,8542,"Korea Advanced Institute of Science and Technology, Daejeon, South Korea"
7113,8542,"Korea Advanced Institute of Science and Technology, Taejon, Korea"
